{
  "name": "vscode-copilot",
  "version": "0.1.0",
  "description": "Target adapter for generating GitHub Copilot custom agents and skills for VS Code.",
  "outputPaths": {
    "agents": ".github/agents",
    "skills": ".github/skills",
    "instructions": ".github/copilot-instructions.md"
  },
  "permissionMapping": {
    "read-only": {
      "tools": [
        "search",
        "read/readFile"
      ],
      "notes": "Read-only agents should not edit files or run destructive commands."
    },
    "implementation": {
      "tools": [
        "search",
        "read/readFile",
        "edit/editFiles",
        "execute/runInTerminal",
        "execute/testFailure"
      ],
      "notes": "Implementation agents may edit files and run relevant validation commands."
    },
    "test-runner": {
      "tools": [
        "search",
        "read/readFile",
        "edit/editFiles",
        "execute/runInTerminal",
        "execute/testFailure"
      ],
      "notes": "Test runner agents may execute validation commands but should not own product design decisions."
    }
  },
  "ownedPaths": [
    ".github/agents",
    ".github/skills",
    ".github/copilot-instructions.md"
  ]
}
